{
    "$schema": "../brand.schema.json",
    "slug": "personalizada",
    "name": "Personalizada",
    "palettes_source": "catalog",
    "colors": {
        "primary_dark": "#303740",
        "primary_light": "#D5D8DC",
        "primary_mid": "#4F5D6E"
    },
    "font_family": "Poppins",
    "font_files": {
        "regular": "fonts/regular.ttf",
        "bold": "fonts/bold.ttf",
        "medium": "fonts/medium.ttf",
        "light": "fonts/light.ttf",
        "italic": "fonts/italic.ttf"
    },
    "icon_file": "icon.svg",
    "logo_fallback_text": "",
    "document_author": ""
}
